{"id":"UNT-900002","schemaVersion":"0.1.0","recordVersion":"0.1.0","revision":0,"status":"Draft","createdAt":"2026-09-09T10:00:00Z","createdBy":"example-author","updatedAt":"2026-09-09T10:00:00Z","updatedBy":"example-author","sourceLinks":[],"changeSummary":"Fictional validation fixture.","name":"Example Unit Beta","symbol":"uB"}
