{"id":"UNT-900005","schemaVersion":"0.1.0","recordVersion":"0.1.0","revision":0,"status":"Review","createdAt":"2026-09-09T10:00:00Z","createdBy":"example-author","updatedAt":"2026-09-09T10:00:00Z","updatedBy":"example-reviewer","sourceLinks":[{"sourceReferenceId":"SRC-900001","sourceClass":"N","supportedClaim":"Fictional unit definition.","usageType":"citation","verificationStatus":"Reviewed"}],"changeSummary":"Fictional validation fixture.","name":"Example Unit Epsilon","symbol":"uE"}
